<?xml version="1.0" encoding="UTF-8"?>
<expressions xmlns:xsi="http://www.w3.org/2001/XMLSchema-instance" xsi:noNamespaceSchemaLocation="RegexExpression.xsd">
<expression>
        <description>x1100xx11100xx</description>
        <pattern>PP00..PPP</pattern>
        <offsetY>0</offsetY>
        <offsetX>2</offsetX>
        <modMin>1</modMin>
        <modMax>3</modMax>
    </expression>
    <expression>
        <description>x1011xx1101xxx</description>
        <pattern>P0PP..PP0P</pattern>
        <offsetY>0</offsetY>
        <offsetX>1</offsetX>
        <modMin>1</modMin>
        <modMax>3</modMax>
    </expression>
    <expression>
        <description>xx0011xxx00111</description>
        <pattern>PP...00PPP</pattern>
        <offsetY>0</offsetY>
        <offsetX>1</offsetX>
        <modMin>0</modMin>
        <modMax>2</modMax>
    </expression>
    <expression>
        <description>x1011xx1101xxx</description>
        <pattern>P0PP..PP0P</pattern>
        <offsetY>0</offsetY>
        <offsetX>1</offsetX>
        <modMin>1</modMin>
        <modMax>3</modMax>
    </expression>
    <expression>
        <description>xx1010x1110x0x</description>
        <pattern>P0P0.PPP0.0</pattern>
        <offsetY>0</offsetY>
        <offsetX>1</offsetX>
        <modMin>3</modMin>
        <modMax>4</modMax>
    </expression>
    <expression>
        <description>xx1010xx11010x</description>
        <pattern>P0P0..PP0P0</pattern>
        <offsetY>0</offsetY>
        <offsetX>1</offsetX>
        <modMin>1</modMin>
        <modMax>3</modMax>
    </expression>
    <expression>
        <description>xxx0110xx10110</description>
        <pattern>0PP0..P0PP0</pattern>
        <offsetY>0</offsetY>
        <offsetX>0</offsetX>
        <modMin>1</modMin>
        <modMax>3</modMax>
    </expression>
    <expression>
        <description>xx1010xx11010x</description>
        <pattern>P0P0..PP0P0</pattern>
        <offsetY>0</offsetY>
        <offsetX>1</offsetX>
        <modMin>1</modMin>
        <modMax>3</modMax>
    </expression>
    <expression>
        <description>xx1101xxx1101x</description>
        <pattern>PP0P...PP0P</pattern>
        <offsetY>0</offsetY>
        <offsetX>2</offsetX>
        <modMin>0</modMin>
        <modMax>3</modMax>
    </expression>
    <expression>
        <description>x1011xxx1011xx</description>
        <pattern>P0PP...P0PP</pattern>
        <offsetY>0</offsetY>
        <offsetX>1</offsetX>
        <modMin>0</modMin>
        <modMax>3</modMax>
    </expression>
    <expression>
        <description>x0101xxx01011x</description>
        <pattern>0P0P...0P0PP</pattern>
        <offsetY>0</offsetY>
        <offsetX>0</offsetX>
        <modMin>0</modMin>
        <modMax>2</modMax>
    </expression>
    <expression>
        <description>x0101xxx01011x</description>
        <pattern>0P0P...0P0PP</pattern>
        <offsetY>0</offsetY>
        <offsetX>0</offsetX>
        <modMin>0</modMin>
        <modMax>2</modMax>
    </expression>
    <expression>
        <description>xx1101xxxx1011</description>
        <pattern>PP0P....P0PP</pattern>
        <offsetY>0</offsetY>
        <offsetX>2</offsetX>
        <modMin>0</modMin>
        <modMax>2</modMax>
    </expression>
    <expression>
        <description>x0101xxx0x0111</description>
        <pattern>0P0P...0.0PPP</pattern>
        <offsetY>0</offsetY>
        <offsetX>0</offsetX>
        <modMin>0</modMin>
        <modMax>1</modMax>
    </expression>
    <expression>
        <description>xxx0xxxx1101xxx1x0xxx</description>
        <pattern>0....PP0P...P.0</pattern>
        <offsetY>0</offsetY>
        <offsetX>0</offsetX>
        <modMin>2</modMin>
        <modMax>5</modMax>
    </expression>
    <expression>
        <description>xxxxxx1xxx0x1xxxx0111xxx0xxx</description>
        <pattern>P...0.P....0PPP</pattern>
        <offsetY>1</offsetY>
        <offsetX>-3</offsetX>
        <modMin>3</modMin>
        <modMax>6</modMax>
    </expression>
    <expression>
        <description>xx1101xxxx1011</description>
        <pattern>PP0P[0-2]{4}P0PP</pattern>
        <offsetY>0</offsetY>
        <offsetX>2</offsetX>
        <modMin>0</modMin>
        <modMax>2</modMax>
    </expression>
    <expression>
        <description>xxxxx0xxxx1101xxx1101</description>
        <pattern>0....PP0P...PP0P</pattern>
        <offsetY>0</offsetY>
        <offsetX>0</offsetX>
        <modMin>2</modMin>
        <modMax>5</modMax>
    </expression>
    <expression>
        <description>xxxxx1xxxxxx1xxxx1100</description>
        <pattern>P......P....PP00</pattern>
        <offsetY>2</offsetY>
        <offsetX>0</offsetX>
        <modMin>2</modMin>
        <modMax>5</modMax>
    </expression>
    <expression>
        <description>x0110xx10110xx</description>
        <pattern>0PP0[0-2]{2}P0PP0</pattern>
        <offsetY>0</offsetY>
        <offsetX>0</offsetX>
        <modMin>1</modMin>
        <modMax>3</modMax>
    </expression>
    <expression>
        <description>xx0110xxx01101</description>
        <pattern>0PP0[0-2]{3}0PP0P</pattern>
        <offsetY>0</offsetY>
        <offsetX>0</offsetX>
        <modMin>0</modMin>
        <modMax>3</modMax>
    </expression>
    <expression>
        <description>xx101xxx1101xxx1101xx</description>
        <pattern>P0P...PP0P...PP0P</pattern>
        <offsetY>0</offsetY>
        <offsetX>1</offsetX>
        <modMin>1</modMin>
        <modMax>4</modMax>
    </expression>
    <expression>
        <description>x0xxxxx1011xxx1011xxx</description>
        <pattern>0.....P0PP...P0PP</pattern>
        <offsetY>0</offsetY>
        <offsetX>0</offsetX>
        <modMin>1</modMin>
        <modMax>3</modMax>
    </expression>
    <expression>
        <description>x1xxxxxx1xxxxx0011xxx</description>
        <pattern>P......P.....00PP</pattern>
        <offsetY>2</offsetY>
        <offsetX>0</offsetX>
        <modMin>1</modMin>
        <modMax>4</modMax>
    </expression>
    <expression>
        <description>xxx0xxxxx1011x1110xxx</description>
        <pattern>0[0-2]{5}P0PP.PPP0</pattern>
        <offsetY>0</offsetY>
        <offsetX>0</offsetX>
        <modMin>3</modMin>
        <modMax>4</modMax>
    </expression>
    <expression>
        <description>xxx0xxxx1101xxxxx0111</description>
        <pattern>0PPP.PP0P[0-2]{5}0</pattern>
        <offsetY>0</offsetY>
        <offsetX>0</offsetX>
        <modMin>2</modMin>
        <modMax>3</modMax>
    </expression>
    <expression>
        <description>1xxxxxxx1x0xxx1110xxxxxx0xxx</description>
        <pattern>P.......P.0...PPP0</pattern>
        <offsetY>1</offsetY>
        <offsetX>3</offsetX>
        <modMin>0</modMin>
        <modMax>3</modMax>
    </expression>
    <expression>
        <description>xxxxx1xxx0x1xxxx0111xxx0xxxx</description>
        <pattern>P...0.P....0PPP...0</pattern>
        <offsetY>1</offsetY>
        <offsetX>-3</offsetX>
        <modMin>3</modMin>
        <modMax>6</modMax>
    </expression>
    <expression>
        <description>xxx1100xx11100xxxxx00</description>
        <pattern>PP00..PPP00[0-2]{5}00</pattern>
        <offsetY>0</offsetY>
        <offsetX>2</offsetX>
        <modMin>1</modMin>
        <modMax>3</modMax>
    </expression>
    <expression>
        <description>0011xxx00111xx00xxxxx</description>
        <pattern>00PP[0-2]{3}00PPP..00</pattern>
        <offsetY>0</offsetY>
        <offsetX>1</offsetX>
        <modMin>0</modMin>
        <modMax>2</modMax>
    </expression>
    <expression>
        <description>xxx1101xxx1101</description>
        <pattern>PP0P{P,}[0-2]{2,}PP0P</pattern>
        <offsetY>0</offsetY>
        <offsetX>2</offsetX>
        <modMin>0</modMin>
        <modMax>3</modMax>
    </expression>
    <expression>
        <description>xxx1xxxxx1xxxx0011xxx</description>
        <pattern>P[0-2]{5}P[0-2]{4}00PP</pattern>
        <offsetY>2</offsetY>
        <offsetX>-2</offsetX>
        <modMin>3</modMin>
        <modMax>6</modMax>
    </expression>

    </expressions>
